{
  "schema_version": "learning-path/v0.1",
  "path_id": "system-architect-checkin",
  "version": "1.0.0",
  "status": "draft",
  "title": "系统架构设计师打卡学习路径",
  "taxonomy_version": "0.1",
  "source": {
    "type": "user_provided_checkin_archive",
    "archive_name": "系统架构设计师打卡.zip",
    "archive_size_bytes": 175511,
    "archive_sha256": "d7e8f68374f250dab72f2a08c543cbe9cbd44533fdc8e1e32c1a0d0e67fce17a",
    "description": "用户已有系统架构设计师打卡顺序；仅作为学习路径来源与 provenance，不据此认定内容许可或复制原文。"
  },
  "ordering": {
    "basis": "source_date ascending, then archive-relative source_file ascending",
    "date_semantics": "provenance_only; source_date is not a required study date or calendar schedule",
    "order_semantics": "one-based ordinal across all dated archive records, including NON_LEARNING records; filter NON_LEARNING to obtain the learning sequence"
  },
  "items": [
    {
      "item_id": "checkin-001",
      "order": 1,
      "source_date": "2026-06-08",
      "source_file": "2026年06月/2026-06-08.md",
      "source_title": "软件工程",
      "topic_ids": [
        "SOFTWARE.ENGINEERING.PROCESS"
      ],
      "mapping_status": "merge",
      "mapping_confidence": "high",
      "mapping_notes": "与第 2–5 项共同构成连续的软件过程与开发方法学习簇；本项覆盖生命周期和工程三要素。",
      "knowledge_point_titles": [
        "手工作坊式软件开发的弊端",
        "软件工程",
        "软件工程三要素"
      ],
      "original_topic_title": "软件工程",
      "mapping_group_id": "merge-software-process-01"
    },
    {
      "item_id": "checkin-002",
      "order": 2,
      "source_date": "2026-06-09",
      "source_file": "2026年06月/2026-06-09.md",
      "source_title": "软件工程",
      "topic_ids": [
        "SOFTWARE.ENGINEERING.PROCESS"
      ],
      "mapping_status": "merge",
      "mapping_confidence": "high",
      "mapping_notes": "瀑布、演化、螺旋、RAD 等开发模型是同一过程主题的分日展开。",
      "knowledge_point_titles": [
        "瀑布模型",
        "演化模型（原型模型）",
        "螺旋模型",
        "快速应用开发（RAD）",
        "喷泉模型",
        "形式化开发方法"
      ],
      "original_topic_title": "软件工程",
      "mapping_group_id": "merge-software-process-01"
    },
    {
      "item_id": "checkin-003",
      "order": 3,
      "source_date": "2026-06-10",
      "source_file": "2026年06月/2026-06-10.md",
      "source_title": "软件工程",
      "topic_ids": [
        "SOFTWARE.ENGINEERING.PROCESS"
      ],
      "mapping_status": "merge",
      "mapping_confidence": "high",
      "mapping_notes": "RUP 的阶段与工作流属于软件过程方法；与相邻开发模型日合并覆盖同一 L3。",
      "knowledge_point_titles": [
        "统一过程 RUP"
      ],
      "original_topic_title": "软件工程",
      "mapping_group_id": "merge-software-process-01"
    },
    {
      "item_id": "checkin-004",
      "order": 4,
      "source_date": "2026-06-11",
      "source_file": "2026年06月/2026-06-11.md",
      "source_title": "软件工程",
      "topic_ids": [
        "SOFTWARE.ENGINEERING.PROCESS"
      ],
      "mapping_status": "merge",
      "mapping_confidence": "high",
      "mapping_notes": "敏捷宣言与 Scrum、XP 等方法属于软件过程方法；与相邻 check-in 合并覆盖同一 L3。",
      "knowledge_point_titles": [
        "敏捷开发"
      ],
      "original_topic_title": "软件工程",
      "mapping_group_id": "merge-software-process-01"
    },
    {
      "item_id": "checkin-005",
      "order": 5,
      "source_date": "2026-06-12",
      "source_file": "2026年06月/2026-06-12.md",
      "source_title": "软件工程",
      "topic_ids": [
        "SOFTWARE.ENGINEERING.PROCESS",
        "SOFTWARE.ENGINEERING.TESTING"
      ],
      "mapping_status": "split",
      "mapping_confidence": "high",
      "mapping_notes": "V/W 模型属于开发过程与验证关系，测试左移明确跨越软件过程和软件测试两个边界。",
      "knowledge_point_titles": [
        "V 模型",
        "W 模型",
        "质量左移（测试）左移"
      ],
      "original_topic_title": "软件工程"
    },
    {
      "item_id": "checkin-006",
      "order": 6,
      "source_date": "2026-06-13",
      "source_file": "2026年06月/2026-06-13.md",
      "source_title": "软件工程",
      "topic_ids": [
        "SOFTWARE.ENGINEERING.COMPONENTS"
      ],
      "mapping_status": "exact",
      "mapping_confidence": "high",
      "mapping_notes": "构件开发、构件特征、适配和组装与构件技术边界一致。",
      "knowledge_point_titles": [
        "基于构件的软件开发方法（CBSD/CBSE）",
        "标准化：使用的构件必须符合某种标准化的构件模型",
        "系统需求概览",
        "识别候选构件",
        "根据发现的构件修改需求",
        "架构设计",
        "构件定制与适配",
        "组装构件，创建系统"
      ],
      "original_topic_title": "软件工程"
    },
    {
      "item_id": "checkin-007",
      "order": 7,
      "source_date": "2026-06-14",
      "source_file": "2026年06月/2026-06-14.md",
      "source_title": "软件工程",
      "topic_ids": [
        "SOFTWARE.MODELING.FORMAL_MODELING"
      ],
      "mapping_status": "exact",
      "mapping_confidence": "high",
      "mapping_notes": "计算无关、平台独立和平台特定模型直接对应模型驱动建模。",
      "knowledge_point_titles": [
        "模型驱动开发方法"
      ],
      "original_topic_title": "软件工程"
    },
    {
      "item_id": "checkin-008",
      "order": 8,
      "source_date": "2026-06-15",
      "source_file": "2026年06月/2026-06-15.md",
      "source_title": "软件工程",
      "topic_ids": [
        "ARCH.FOUNDATION.ABSD"
      ],
      "mapping_status": "exact",
      "mapping_confidence": "high",
      "mapping_notes": "主题及 ABSD 需求、设计、文档化、复审、实现和演化活动与现有 L3 一致。",
      "knowledge_point_titles": [
        "基于架构的软件开发方法（ABSD）"
      ],
      "original_topic_title": "软件工程"
    },
    {
      "item_id": "checkin-009",
      "order": 9,
      "source_date": "2026-06-16",
      "source_file": "2026年06月/2026-06-16.md",
      "source_title": "架构",
      "topic_ids": [
        "ARCH.FOUNDATION.CONCEPTS",
        "ARCH.FOUNDATION.REUSE"
      ],
      "mapping_status": "split",
      "mapping_confidence": "high",
      "mapping_notes": "架构概念/描述与可复用资产及架构复用是两个可区分主题。",
      "knowledge_point_titles": [
        "架构概述",
        "获取可复用的软件资产",
        "管理可复用资产",
        "使用可复用资产"
      ],
      "original_topic_title": "架构"
    },
    {
      "item_id": "checkin-010",
      "order": 10,
      "source_date": "2026-06-17",
      "source_file": "2026年06月/2026-06-17.md",
      "source_title": "架构",
      "topic_ids": [
        "ARCH.FOUNDATION.REUSE"
      ],
      "mapping_status": "partial",
      "mapping_confidence": "medium",
      "mapping_notes": "DSSA 是领域架构和复用的一个具体方法，仅覆盖架构复用主题的一部分。",
      "knowledge_point_titles": [
        "DSSA 的概念",
        "DSSA 的基本活动",
        "参与 DSSA 的 人员"
      ],
      "original_topic_title": "架构"
    },
    {
      "item_id": "checkin-011",
      "order": 11,
      "source_date": "2026-06-18",
      "source_file": "2026年06月/2026-06-18.md",
      "source_title": "架构",
      "topic_ids": [
        "QUALITY.ATTRIBUTES.MODIFIABILITY",
        "QUALITY.EVALUATION.SCENARIOS"
      ],
      "mapping_status": "split",
      "mapping_confidence": "high",
      "mapping_notes": "质量属性场景覆盖评估场景，后续可修改性部分映射可修改性属性；不是完整质量属性课程。",
      "knowledge_point_titles": [
        "质量属性"
      ],
      "original_topic_title": "架构"
    },
    {
      "item_id": "checkin-012",
      "order": 12,
      "source_date": "2026-06-19",
      "source_file": "2026年06月/2026-06-19.md",
      "source_title": "架构",
      "topic_ids": [
        "ARCH.FOUNDATION.STYLES"
      ],
      "mapping_status": "partial",
      "mapping_confidence": "high",
      "mapping_notes": "仅覆盖数据流、批处理与管道过滤器等架构风格子集。",
      "knowledge_point_titles": [
        "数据流架构风格"
      ],
      "original_topic_title": "架构"
    },
    {
      "item_id": "checkin-013",
      "order": 13,
      "source_date": "2026-06-20",
      "source_file": "2026年06月/2026-06-20.md",
      "source_title": "架构",
      "topic_ids": [
        "ARCH.FOUNDATION.STYLES",
        "ARCH.LAYERED.LAYERS"
      ],
      "mapping_status": "split",
      "mapping_confidence": "high",
      "mapping_notes": "调用返回与面向对象风格属于架构风格；层次风格/层次组成另属层次式架构。",
      "knowledge_point_titles": [
        "调用/返回架构风格"
      ],
      "original_topic_title": "架构"
    },
    {
      "item_id": "checkin-014",
      "order": 14,
      "source_date": "2026-06-21",
      "source_file": "2026年06月/2026-06-21.md",
      "source_title": "架构",
      "topic_ids": [
        "ARCH.FOUNDATION.STYLES"
      ],
      "mapping_status": "partial",
      "mapping_confidence": "high",
      "mapping_notes": "仓库和黑板架构只是以数据为中心风格的部分实例。",
      "knowledge_point_titles": [
        "以数据为中心的架构风格"
      ],
      "original_topic_title": "架构"
    },
    {
      "item_id": "checkin-015",
      "order": 15,
      "source_date": "2026-06-22",
      "source_file": "2026年06月/2026-06-22.md",
      "source_title": "架构",
      "topic_ids": [
        "ARCH.FOUNDATION.STYLES"
      ],
      "mapping_status": "partial",
      "mapping_confidence": "high",
      "mapping_notes": "解释器和规则系统是架构风格专题的局部覆盖，不覆盖其他风格。",
      "knowledge_point_titles": [
        "解释器架构风格",
        "规则系统"
      ],
      "original_topic_title": "架构"
    },
    {
      "item_id": "checkin-016",
      "order": 16,
      "source_date": "2026-06-23",
      "source_file": "2026年06月/2026-06-23.md",
      "source_title": "架构",
      "topic_ids": [
        "ARCH.FOUNDATION.STYLES",
        "ARCH.CLOUD_NATIVE.EVENT_DRIVEN"
      ],
      "mapping_status": "split",
      "mapping_confidence": "high",
      "mapping_notes": "独立构件/进程通信属于风格分类，事件驱动部分直接映射事件驱动架构。",
      "knowledge_point_titles": [
        "独立构件架构风格"
      ],
      "original_topic_title": "架构"
    },
    {
      "item_id": "checkin-017",
      "order": 17,
      "source_date": "2026-06-24",
      "source_file": "2026年06月/2026-06-24.md",
      "source_title": "架构",
      "topic_ids": [
        "QUALITY.EVALUATION.SCENARIOS"
      ],
      "mapping_status": "partial",
      "mapping_confidence": "medium",
      "mapping_notes": "知识点明确包含基于场景的评估，但也概述问卷和度量方法；当前 L3 仅能覆盖场景部分。",
      "knowledge_point_titles": [
        "架构评估"
      ],
      "original_topic_title": "架构"
    },
    {
      "item_id": "checkin-018",
      "order": 18,
      "source_date": "2026-06-25",
      "source_file": "2026年06月/2026-06-25.md",
      "source_title": "架构",
      "topic_ids": [
        "QUALITY.EVALUATION.ATAM",
        "QUALITY.EVALUATION.TRADEOFF"
      ],